{
  "schemaVersion": "1.0",
  "id": "smoke-sign-v0",
  "label": "SmokeSign",
  "canvas": { "width": 480, "height": 200 },
  "terminals": [
    { "id": "in",  "kind": "input",  "x":  40, "y": 100 },
    { "id": "out", "kind": "output", "x": 440, "y": 100 }
  ],
  "nodes": [
    { "id": "n_sign", "op": "sign", "x": 240, "y": 100 }
  ],
  "wires": [
    { "from": "in",     "to": "n_sign" },
    { "from": "n_sign", "to": "out"    }
  ],
  "feedback": [],
  "legendOps": ["sign"]
}
