{
  "schemaVersion": "1.0",
  "id": "smoke-optocell-v0",
  "label": "SmokeOptoCell",
  "canvas": { "width": 480, "height": 200 },
  "terminals": [
    { "id": "in",  "kind": "input",  "x":  40, "y": 100 },
    { "id": "out", "kind": "output", "x": 440, "y": 100 }
  ],
  "nodes": [
    { "id": "n_oc", "op": "optoCell", "x": 240, "y": 100, "params": { "attackMs": 10, "releaseMsFast": 60, "releaseSecSlow": 5, "responsivity": 1.0 } }
  ],
  "wires": [
    { "from": "in",   "to": "n_oc.cv" },
    { "from": "n_oc.gain", "to": "out" }
  ],
  "feedback": [],
  "legendOps": ["optoCell"]
}
