{
  "schemaVersion": "1.0",
  "id": "smoke-panner-v0",
  "label": "SmokePanner",
  "canvas": {
    "width": 480,
    "height": 200
  },
  "terminals": [
    {
      "id": "in",
      "kind": "input",
      "x": 40,
      "y": 60
    },
    {
      "id": "l",
      "kind": "output",
      "x": 440,
      "y": 60
    },
    {
      "id": "r",
      "kind": "output",
      "x": 440,
      "y": 140
    }
  ],
  "nodes": [
    {
      "id": "n_panner",
      "op": "panner",
      "x": 240,
      "y": 100,
      "params": {
        "pan": 0,
        "law": 1
      }
    }
  ],
  "wires": [
    {
      "from": "in",
      "to": "n_panner.in"
    },
    {
      "from": "n_panner.l",
      "to": "l"
    },
    {
      "from": "n_panner.r",
      "to": "r"
    }
  ],
  "feedback": [],
  "legendOps": [
    "panner"
  ]
}
