{
  "schemaVersion": "1.0",
  "id": "smoke-wavefolder-v0",
  "label": "SmokeWavefolder",
  "canvas": { "width": 480, "height": 200 },
  "terminals": [
    { "id": "in",  "kind": "input",  "x":  40, "y": 100 },
    { "id": "out", "kind": "output", "x": 440, "y": 100 }
  ],
  "nodes": [
    { "id": "n_wf", "op": "wavefolder", "x": 240, "y": 100, "params": { "drive": 1.5, "width": 0.6, "trim": -2.0 } }
  ],
  "wires": [
    { "from": "in",   "to": "n_wf.in" },
    { "from": "n_wf.out", "to": "out" }
  ],
  "feedback": [],
  "legendOps": ["wavefolder"]
}
