{
  "schemaVersion": "1.0",
  "id": "smoke-stft-v0",
  "label": "SmokeStft",
  "canvas": {
    "width": 480,
    "height": 200
  },
  "terminals": [
    {
      "id": "in",
      "kind": "input",
      "x": 40,
      "y": 60
    },
    {
      "id": "mag",
      "kind": "output",
      "x": 440,
      "y": 60
    },
    {
      "id": "phase",
      "kind": "output",
      "x": 440,
      "y": 140
    }
  ],
  "nodes": [
    {
      "id": "n_stft",
      "op": "stft",
      "x": 240,
      "y": 100,
      "params": {
        "size": 1024,
        "hop": 256
      }
    }
  ],
  "wires": [
    {
      "from": "in",
      "to": "n_stft.in"
    },
    {
      "from": "n_stft.mag",
      "to": "mag"
    },
    {
      "from": "n_stft.phase",
      "to": "phase"
    }
  ],
  "feedback": [],
  "legendOps": [
    "stft"
  ]
}
