{
  "schemaVersion": "1.0",
  "id": "smoke-sidechainhpf-v0",
  "label": "SmokeSidechainHPF",
  "canvas": {
    "width": 480,
    "height": 200
  },
  "terminals": [
    {
      "id": "in",
      "kind": "input",
      "x": 40,
      "y": 60
    },
    {
      "id": "out",
      "kind": "output",
      "x": 440,
      "y": 60
    }
  ],
  "nodes": [
    {
      "id": "n_sidechainhpf",
      "op": "sidechainHPF",
      "x": 240,
      "y": 100,
      "params": {
        "cutoff": 100,
        "q": 0.707,
        "order": 1
      }
    }
  ],
  "wires": [
    {
      "from": "in",
      "to": "n_sidechainhpf.in"
    },
    {
      "from": "n_sidechainhpf.out",
      "to": "out"
    }
  ],
  "feedback": [],
  "legendOps": [
    "sidechainHPF"
  ]
}
