{
  "schemaVersion": "1.0",
  "id": "smoke-filter-v0",
  "label": "SmokeFilter",
  "canvas": { "width": 480, "height": 200 },
  "terminals": [
    { "id": "in",  "kind": "input",  "x":  40, "y": 100 },
    { "id": "out", "kind": "output", "x": 440, "y": 100 }
  ],
  "nodes": [
    { "id": "n_filt", "op": "filter", "x": 240, "y": 100,
      "params": { "mode": "lp", "cutoff": 1000, "q": 0.707 } }
  ],
  "wires": [
    { "from": "in",     "to": "n_filt" },
    { "from": "n_filt", "to": "out"    }
  ],
  "feedback": [],
  "legendOps": ["filter"]
}
