{
  "schemaVersion": "1.0",
  "id": "smoke-yin-v0",
  "label": "SmokeYin",
  "canvas": {
    "width": 480,
    "height": 200
  },
  "terminals": [
    {
      "id": "in",
      "kind": "input",
      "x": 40,
      "y": 60
    },
    {
      "id": "f0",
      "kind": "output",
      "x": 440,
      "y": 60
    },
    {
      "id": "conf",
      "kind": "output",
      "x": 440,
      "y": 140
    }
  ],
  "nodes": [
    {
      "id": "n_yin",
      "op": "yin",
      "x": 240,
      "y": 100,
      "params": {
        "f0Min": 80,
        "f0Max": 1000,
        "threshold": 0.1
      }
    }
  ],
  "wires": [
    {
      "from": "in",
      "to": "n_yin.in"
    },
    {
      "from": "n_yin.f0",
      "to": "f0"
    },
    {
      "from": "n_yin.conf",
      "to": "conf"
    }
  ],
  "feedback": [],
  "legendOps": [
    "yin"
  ]
}
