{
  "schemaVersion": "1.0",
  "id": "smoke-lpc-v0",
  "label": "SmokeLpc",
  "canvas": {
    "width": 480,
    "height": 200
  },
  "terminals": [
    {
      "id": "in",
      "kind": "input",
      "x": 40,
      "y": 60
    },
    {
      "id": "residual",
      "kind": "output",
      "x": 440,
      "y": 60
    }
  ],
  "nodes": [
    {
      "id": "n_lpc",
      "op": "lpc",
      "x": 240,
      "y": 100,
      "params": {
        "order": 12,
        "blockN": 1024
      }
    }
  ],
  "wires": [
    {
      "from": "in",
      "to": "n_lpc.in"
    },
    {
      "from": "n_lpc.residual",
      "to": "residual"
    }
  ],
  "feedback": [],
  "legendOps": [
    "lpc"
  ]
}
