{
  "schemaVersion": "1.0",
  "id": "smoke-rms-v0",
  "label": "SmokeRms",
  "canvas": {
    "width": 480,
    "height": 200
  },
  "terminals": [
    {
      "id": "in",
      "kind": "input",
      "x": 40,
      "y": 60
    },
    {
      "id": "rms",
      "kind": "output",
      "x": 440,
      "y": 60
    }
  ],
  "nodes": [
    {
      "id": "n_rms",
      "op": "rms",
      "x": 240,
      "y": 100,
      "params": {
        "window": 300
      }
    }
  ],
  "wires": [
    {
      "from": "in",
      "to": "n_rms.in"
    },
    {
      "from": "n_rms.rms",
      "to": "rms"
    }
  ],
  "feedback": [],
  "legendOps": [
    "rms"
  ]
}
