{
  "schemaVersion": "1.0",
  "id": "smoke-randomwalk-v0",
  "label": "SmokeRandomWalk",
  "canvas": {
    "width": 480,
    "height": 200
  },
  "terminals": [
    {
      "id": "in",
      "kind": "input",
      "x": 40,
      "y": 100
    },
    {
      "id": "out",
      "kind": "output",
      "x": 440,
      "y": 60
    }
  ],
  "nodes": [
    {
      "id": "n_randomwalk",
      "op": "randomWalk",
      "x": 240,
      "y": 100,
      "params": {
        "step": 0.125,
        "level": 1
      }
    }
  ],
  "wires": [
    {
      "from": "n_randomwalk.out",
      "to": "out"
    }
  ],
  "feedback": [],
  "legendOps": [
    "randomWalk"
  ]
}
