{
  "schemaVersion": "1.0",
  "id": "smoke-istft-v0",
  "label": "SmokeIstft",
  "canvas": {
    "width": 480,
    "height": 200
  },
  "terminals": [
    {
      "id": "mag",
      "kind": "input",
      "x": 40,
      "y": 60
    },
    {
      "id": "phase",
      "kind": "input",
      "x": 40,
      "y": 140
    },
    {
      "id": "out",
      "kind": "output",
      "x": 440,
      "y": 60
    }
  ],
  "nodes": [
    {
      "id": "n_istft",
      "op": "istft",
      "x": 240,
      "y": 100,
      "params": {
        "size": 1024,
        "hop": 256
      }
    }
  ],
  "wires": [
    {
      "from": "mag",
      "to": "n_istft.mag"
    },
    {
      "from": "phase",
      "to": "n_istft.phase"
    },
    {
      "from": "n_istft.out",
      "to": "out"
    }
  ],
  "feedback": [],
  "legendOps": [
    "istft"
  ]
}
