{
  "schemaVersion": "1.0",
  "id": "smoke-er-v0",
  "label": "SmokeER",
  "canvas": {
    "width": 480,
    "height": 200
  },
  "terminals": [
    {
      "id": "in",
      "kind": "input",
      "x": 40,
      "y": 60
    },
    {
      "id": "out",
      "kind": "output",
      "x": 440,
      "y": 60
    }
  ],
  "nodes": [
    {
      "id": "n_er",
      "op": "ER",
      "x": 240,
      "y": 100,
      "params": {
        "roomSize": 1,
        "airHz": 8000,
        "level": 1,
        "mix": 1
      }
    }
  ],
  "wires": [
    {
      "from": "in",
      "to": "n_er.in"
    },
    {
      "from": "n_er.out",
      "to": "out"
    }
  ],
  "feedback": [],
  "legendOps": [
    "ER"
  ]
}
